{
  "$schema": "https://json-schema.org/draft/2020-12/schema",
  "$id": "darwin.product-handoff/2",
  "title": "Darwin publication-ready product handoff, version 2",
  "description": "Prepared products only. A handoff never publishes, moves a current-version pointer or grants access: those belong to the consuming catalogue. Each product entry also carries every legacy (unversioned v1) field except `status`, so a v1 importer that ignores unknown keys still reads it.",
  "type": "object",
  "required": ["contract", "release", "manifest", "manifest_revision", "creator", "created_at", "synthetic", "products"],
  "properties": {
    "contract": {"const": "darwin.product-handoff/2"},
    "release": {"type": "string", "minLength": 1},
    "manifest": {"type": "string", "minLength": 1},
    "manifest_revision": {"$ref": "#/$defs/sha256"},
    "creator": {"type": "string", "minLength": 1},
    "created_at": {"type": "string", "pattern": "^\\d{4}-\\d{2}-\\d{2}T\\d{2}:\\d{2}:\\d{2}Z$"},
    "synthetic": {"type": "boolean"},
    "products": {"type": "array", "minItems": 1, "items": {"$ref": "#/$defs/product"}}
  },
  "not": {"anyOf": [{"required": ["status"]}, {"required": ["access"]}, {"required": ["current_version"]}]},
  "$defs": {
    "sha256": {"type": "string", "pattern": "^[0-9a-f]{64}$"},
    "identity": {
      "type": "object", "additionalProperties": false,
      "required": ["id", "version", "sha256"],
      "properties": {
        "id": {"type": "string", "minLength": 1},
        "version": {"type": "string", "minLength": 1, "not": {"enum": ["latest", "current", "HEAD"]}},
        "sha256": {"$ref": "#/$defs/sha256"}
      }
    },
    "artifact": {
      "type": "object", "additionalProperties": false,
      "required": ["name", "kind", "sha256", "size_bytes", "identity_record_sha256"],
      "properties": {
        "name": {"type": "string", "minLength": 1, "pattern": "^[^/]+$"},
        "kind": {"enum": ["file", "directory"]},
        "sha256": {"$ref": "#/$defs/sha256"},
        "size_bytes": {"type": "integer", "minimum": 0},
        "identity_record_sha256": {"$ref": "#/$defs/sha256"}
      }
    },
    "acceptance_reference": {
      "type": "object", "additionalProperties": false,
      "required": ["contract", "id", "sha256", "status", "requirements", "authority", "supersedes"],
      "properties": {
        "contract": {"const": "darwin-wrf-setups.acceptance-assessment/1"},
        "id": {"type": "string", "minLength": 1},
        "sha256": {"$ref": "#/$defs/sha256"},
        "status": {"enum": ["accepted", "rejected", "unassessed"]},
        "requirements": {
          "type": "object", "additionalProperties": false,
          "required": ["id", "revision", "sha256"],
          "properties": {
            "id": {"type": "string", "minLength": 1},
            "revision": {"type": "string", "minLength": 1},
            "sha256": {"$ref": "#/$defs/sha256"}
          }
        },
        "authority": {
          "oneOf": [
            {"type": "null"},
            {
              "type": "object", "additionalProperties": false,
              "required": ["kind", "id", "authorization"],
              "properties": {
                "kind": {"enum": ["reviewer", "policy"]},
                "id": {"type": "string", "minLength": 1},
                "authorization": {"$ref": "#/$defs/identity"}
              }
            }
          ]
        },
        "supersedes": {
          "oneOf": [
            {"type": "null"},
            {
              "type": "object", "additionalProperties": false,
              "required": ["id", "sha256"],
              "properties": {"id": {"type": "string", "minLength": 1}, "sha256": {"$ref": "#/$defs/sha256"}}
            }
          ]
        }
      }
    },
    "product": {
      "type": "object",
      "required": ["candidate_id", "product_id", "version", "kind", "lifecycle", "dataset", "artifacts", "sources", "recipe", "execution_completeness", "execution_evidence", "scientific_status", "acceptance", "manifest_revision", "creator", "created_at"],
      "properties": {
        "candidate_id": {"type": "string", "minLength": 1},
        "product_id": {"type": "string", "minLength": 1},
        "version": {"type": "string", "minLength": 1, "not": {"enum": ["latest", "current", "HEAD"]}},
        "kind": {"type": "string", "minLength": 1},
        "lifecycle": {"const": "prepared"},
        "dataset": {"$ref": "#/$defs/identity"},
        "artifacts": {"type": "array", "minItems": 1, "items": {"$ref": "#/$defs/artifact"}},
        "sources": {
          "type": "array", "minItems": 1,
          "items": {
            "type": "object", "additionalProperties": false, "required": ["id", "sha256"],
            "properties": {"id": {"type": "string", "minLength": 1}, "sha256": {"$ref": "#/$defs/sha256"}}
          }
        },
        "recipe": {"$ref": "#/$defs/identity"},
        "execution_completeness": {"enum": ["complete", "partial", null]},
        "execution_evidence": {"oneOf": [{"type": "null"}, {"$ref": "#/$defs/identity"}]},
        "scientific_status": {"enum": ["accepted", "rejected", "unassessed"]},
        "acceptance": {"type": "array", "items": {"$ref": "#/$defs/acceptance_reference"}},
        "manifest_revision": {"$ref": "#/$defs/sha256"},
        "creator": {"type": "string", "minLength": 1},
        "created_at": {"type": "string", "minLength": 1}
      },
      "not": {"anyOf": [{"required": ["status"]}, {"required": ["access"]}, {"required": ["current_version"]}]},
      "allOf": [
        {
          "if": {"properties": {"execution_completeness": {"const": null}}},
          "then": {"properties": {"execution_evidence": {"type": "null"}}},
          "else": {"properties": {"execution_evidence": {"type": "object"}}}
        }
      ]
    }
  }
}
